{
  "$schema": "http://json-schema.org/draft-07/schema#",
  "schema_version": "1.0",
  "description": "S3 artifact schema — loc coordinates resolved to verbatim text by map_content().",
  "type": "object",
  "required": ["source_ref", "sections", "spec_items"],
  "additionalProperties": false,

  "definitions": {
    "loc": {
      "type": "object",
      "required": ["page", "line_start", "line_end"],
      "additionalProperties": false,
      "description": "Line range in 01_normalized pages[].text split by \\n. line_start and line_end are 1-based and inclusive. For items spanning multiple pages, set page_end; line_start is on page, line_end is on page_end.",
      "properties": {
        "page":       { "type": "integer", "minimum": 1, "description": "Start page (1-based)." },
        "page_end":   { "type": "integer", "minimum": 1, "description": "End page (1-based). Omit for single-page items." },
        "line_start": { "type": "integer", "minimum": 1, "description": "First line on page." },
        "line_end":   { "type": "integer", "minimum": 1, "description": "Last line on page_end (or page if single-page)." }
      }
    }
  },

  "properties": {
    "source_ref": {
      "type": "string",
      "description": "Copy from 01_normalized source_ref."
    },

    "skip_pages": {
      "type": "array",
      "description": "Page numbers (1-based) of purely navigational pages — cover, TOC, revision history, index.",
      "items": { "type": "integer", "minimum": 1 }
    },

    "sections": {
      "type": "array",
      "description": "All headings in document order, each with verbatim content resolved from loc.",
      "items": {
        "type": "object",
        "required": ["spec_hierarchy_number", "title", "loc", "content", "gen_hierarchy_number", "gen_uid"],
        "additionalProperties": false,
        "properties": {
          "spec_hierarchy_number": {
            "type": ["string", "null"],
            "description": "Section number verbatim from the document (e.g. '3.1'). Null for unnumbered headings."
          },
          "level": {
            "type": ["integer", "null"],
            "description": "Depth in the heading hierarchy (1 = top-level)."
          },
          "item_id": {
            "type": ["string", "null"],
            "description": "Spec item ID if the heading line itself carries one. Null otherwise."
          },
          "title": {
            "type": "string",
            "description": "Heading text verbatim."
          },
          "loc": {
            "$ref": "#/definitions/loc",
            "description": "Location of the heading line(s)."
          },
          "content": {
            "type": "string",
            "description": "Verbatim text resolved from loc by map_content()."
          },
          "gen_hierarchy_number": {
            "type": "string",
            "description": "Generated positional reference. 'G' prefix + spec_hierarchy_number (from doc or inferred from level/position). E.g. 'G3.2'. Always present. Changes if the section is renumbered or moved.",
            "pattern": "^G[0-9]+(\\.[0-9]+)*$"
          },
          "gen_uid": {
            "type": "string",
            "description": "Content fingerprint: sha256(normalize(content))[:8 hex uppercase]. Position-independent — survives section renumbering and moves. Changes when and only when the heading text changes.",
            "pattern": "^[0-9A-F]{8}$"
          }
        }
      }
    },

    "spec_items": {
      "type": "array",
      "description": "One entry per item or requirement-like statement, each with verbatim content resolved from loc.",
      "items": {
        "type": "object",
        "required": ["item_id", "spec_hierarchy_number", "item_type", "classification", "loc", "source", "content", "gen_hierarchy_number", "gen_uid"],
        "additionalProperties": false,
        "properties": {
          "item_id": {
            "type": ["string", "null"],
            "description": "Requirement ID verbatim (e.g. 'SYS-FUNC-001'). Null for raw specs without formal IDs."
          },
          "spec_hierarchy_number": {
            "type": ["string", "null"],
            "description": "Item number verbatim from the document if present. Null if absent."
          },
          "item_type": {
            "type": ["string", "null"],
            "enum": ["requirement", "information", "assumption", "constraint", "goal", "other", null]
          },
          "classification": {
            "type": ["string", "null"],
            "enum": ["functional", "performance", "safety", "security", "interface", "other", null]
          },
          "source": {
            "type": "string",
            "enum": ["inline", "table", "list", "other"],
            "description": "Layout the item was extracted from."
          },
          "loc": {
            "$ref": "#/definitions/loc",
            "description": "Full item block location."
          },
          "content": {
            "type": "string",
            "description": "Verbatim text resolved from loc by map_content()."
          },
          "gen_hierarchy_number": {
            "type": "string",
            "description": "Generated positional reference. 'G' prefix + parent section number + 3-digit sequential counter within that section. E.g. 'G3.2-001'. Always present. Changes if the item moves sections or the section is renumbered.",
            "pattern": "^G[0-9]+(\\.[0-9]+)*-[0-9]{3}$"
          },
          "gen_uid": {
            "type": "string",
            "description": "Content fingerprint: sha256(normalize(content))[:8 hex uppercase]. Position-independent — survives section moves and renumbering. Changes when and only when the requirement text changes. Used as stable identity when item_id is null; used for change detection when item_id is present.",
            "pattern": "^[0-9A-F]{8}$"
          },
          "extra_attrs": {
            "type": "object",
            "description": "Explicitly labeled sub-fields (e.g. 'Rationale:', 'Note:'). Keys: snake_case. Values: loc pointing to the sub-field lines within the item block.",
            "propertyNames": { "pattern": "^[a-z][a-z0-9_]*$" },
            "additionalProperties": { "$ref": "#/definitions/loc" }
          },
          "flags": {
            "type": "array",
            "description": "Uncertainty flags.",
            "items": { "type": "string", "pattern": "^[a-z][a-z0-9_]*$" }
          }
        }
      }
    }
  }
}
