{
  "source_ref": "00_raw_extract.json",
  "skip_pages": [],
  "sections": [
    {
      "spec_hierarchy_number": "1",
      "title": "Introduction",
      "level": 1,
      "item_id": null,
      "loc": {
        "page": 1,
        "line_start": 7,
        "line_end": 7
      },
      "content": "1. Introduction",
      "gen_hierarchy_number": "G1",
      "gen_uid": "6E62EE82"
    },
    {
      "spec_hierarchy_number": "1.1",
      "title": "Purpose",
      "level": 2,
      "item_id": null,
      "loc": {
        "page": 1,
        "line_start": 8,
        "line_end": 8
      },
      "content": "1.1 Purpose",
      "gen_hierarchy_number": "G1.1",
      "gen_uid": "AD25A81E"
    },
    {
      "spec_hierarchy_number": "2",
      "title": "System Overview",
      "level": 1,
      "item_id": null,
      "loc": {
        "page": 1,
        "line_start": 14,
        "line_end": 14
      },
      "content": "2. System Overview",
      "gen_hierarchy_number": "G2",
      "gen_uid": "E3D77E94"
    },
    {
      "spec_hierarchy_number": "2.1",
      "title": "Product Description",
      "level": 2,
      "item_id": null,
      "loc": {
        "page": 1,
        "line_start": 15,
        "line_end": 15
      },
      "content": "2.1 Product Description",
      "gen_hierarchy_number": "G2.1",
      "gen_uid": "9A6ABEDF"
    },
    {
      "spec_hierarchy_number": "2.2",
      "title": "Operating Environment",
      "level": 2,
      "item_id": null,
      "loc": {
        "page": 1,
        "line_start": 21,
        "line_end": 21
      },
      "content": "2.2 Operating Environment",
      "gen_hierarchy_number": "G2.2",
      "gen_uid": "833BA170"
    },
    {
      "spec_hierarchy_number": "3",
      "title": "Functional Requirements",
      "level": 1,
      "item_id": null,
      "loc": {
        "page": 2,
        "line_start": 1,
        "line_end": 1
      },
      "content": "3. Functional Requirements",
      "gen_hierarchy_number": "G3",
      "gen_uid": "05ABEEBB"
    },
    {
      "spec_hierarchy_number": "3.1",
      "title": "Navigation",
      "level": 2,
      "item_id": null,
      "loc": {
        "page": 2,
        "line_start": 2,
        "line_end": 2
      },
      "content": "3.1 Navigation",
      "gen_hierarchy_number": "G3.1",
      "gen_uid": "5A265138"
    },
    {
      "spec_hierarchy_number": "3.2",
      "title": "Vacuuming",
      "level": 2,
      "item_id": null,
      "loc": {
        "page": 2,
        "line_start": 13,
        "line_end": 13
      },
      "content": "3.2 Vacuuming",
      "gen_hierarchy_number": "G3.2",
      "gen_uid": "003E696E"
    },
    {
      "spec_hierarchy_number": "3.3",
      "title": "Mopping",
      "level": 2,
      "item_id": null,
      "loc": {
        "page": 2,
        "line_start": 20,
        "line_end": 20
      },
      "content": "3.3 Mopping",
      "gen_hierarchy_number": "G3.3",
      "gen_uid": "790CF19B"
    },
    {
      "spec_hierarchy_number": "3.4",
      "title": "Docking",
      "level": 2,
      "item_id": null,
      "loc": {
        "page": 3,
        "line_start": 5,
        "line_end": 5
      },
      "content": "3.4 Docking",
      "gen_hierarchy_number": "G3.4",
      "gen_uid": "47368774"
    },
    {
      "spec_hierarchy_number": "3.5",
      "title": "User Interaction",
      "level": 2,
      "item_id": null,
      "loc": {
        "page": 3,
        "line_start": 13,
        "line_end": 13
      },
      "content": "3.5 User Interaction",
      "gen_hierarchy_number": "G3.5",
      "gen_uid": "01743409"
    },
    {
      "spec_hierarchy_number": "4",
      "title": "Safety Requirements",
      "level": 1,
      "item_id": null,
      "loc": {
        "page": 3,
        "line_start": 20,
        "line_end": 20
      },
      "content": "4. Safety Requirements",
      "gen_hierarchy_number": "G4",
      "gen_uid": "5365D380"
    },
    {
      "spec_hierarchy_number": "4.1",
      "title": "Mechanical Safety",
      "level": 2,
      "item_id": null,
      "loc": {
        "page": 3,
        "line_start": 21,
        "line_end": 21
      },
      "content": "4.1 Mechanical Safety",
      "gen_hierarchy_number": "G4.1",
      "gen_uid": "87777A4C"
    },
    {
      "spec_hierarchy_number": "4.2",
      "title": "Electrical Safety",
      "level": 2,
      "item_id": null,
      "loc": {
        "page": 4,
        "line_start": 5,
        "line_end": 5
      },
      "content": "4.2 Electrical Safety",
      "gen_hierarchy_number": "G4.2",
      "gen_uid": "9026B453"
    },
    {
      "spec_hierarchy_number": "5",
      "title": "Performance Requirements",
      "level": 1,
      "item_id": null,
      "loc": {
        "page": 4,
        "line_start": 10,
        "line_end": 10
      },
      "content": "5. Performance Requirements",
      "gen_hierarchy_number": "G5",
      "gen_uid": "50F55BAB"
    },
    {
      "spec_hierarchy_number": "6",
      "title": "Cybersecurity Requirements",
      "level": 1,
      "item_id": null,
      "loc": {
        "page": 4,
        "line_start": 19,
        "line_end": 19
      },
      "content": "6. Cybersecurity Requirements",
      "gen_hierarchy_number": "G6",
      "gen_uid": "CCA54D3B"
    },
    {
      "spec_hierarchy_number": "7",
      "title": "Hardware Requirements",
      "level": 1,
      "item_id": null,
      "loc": {
        "page": 5,
        "line_start": 5,
        "line_end": 5
      },
      "content": "7. Hardware Requirements",
      "gen_hierarchy_number": "G7",
      "gen_uid": "C45F7A52"
    },
    {
      "spec_hierarchy_number": "7.1",
      "title": "Sensors",
      "level": 2,
      "item_id": null,
      "loc": {
        "page": 5,
        "line_start": 6,
        "line_end": 6
      },
      "content": "7.1 Sensors",
      "gen_hierarchy_number": "G7.1",
      "gen_uid": "14464129"
    },
    {
      "spec_hierarchy_number": "7.2",
      "title": "Actuators",
      "level": 2,
      "item_id": null,
      "loc": {
        "page": 5,
        "line_start": 17,
        "line_end": 17
      },
      "content": "7.2 Actuators",
      "gen_hierarchy_number": "G7.2",
      "gen_uid": "E89D7B49"
    },
    {
      "spec_hierarchy_number": "8",
      "title": "Software Architecture Requirements",
      "level": 1,
      "item_id": null,
      "loc": {
        "page": 6,
        "line_start": 3,
        "line_end": 3
      },
      "content": "8. Software Architecture Requirements",
      "gen_hierarchy_number": "G8",
      "gen_uid": "CBF01CC7"
    },
    {
      "spec_hierarchy_number": "9",
      "title": "System States",
      "level": 1,
      "item_id": null,
      "loc": {
        "page": 6,
        "line_start": 13,
        "line_end": 13
      },
      "content": "9. System States",
      "gen_hierarchy_number": "G9",
      "gen_uid": "5BC78797"
    }
  ],
  "spec_items": [
    {
      "item_id": "SYS-FUNC-001",
      "spec_hierarchy_number": null,
      "item_type": "requirement",
      "classification": "functional",
      "source": "inline",
      "loc": {
        "page": 2,
        "line_start": 3,
        "line_end": 4
      },
      "content": "SYS-FUNC-001\nThe system shall autonomously generate a 2D indoor map using SLAM.",
      "gen_hierarchy_number": "G3.1-001",
      "gen_uid": "196CB2AF"
    },
    {
      "item_id": "SYS-FUNC-002",
      "spec_hierarchy_number": null,
      "item_type": "requirement",
      "classification": "functional",
      "source": "inline",
      "loc": {
        "page": 2,
        "line_start": 5,
        "line_end": 6
      },
      "content": "SYS-FUNC-002\nThe system shall localize itself with ±5 cm accuracy.",
      "gen_hierarchy_number": "G3.1-002",
      "gen_uid": "7353E5BA"
    },
    {
      "item_id": "SYS-FUNC-003",
      "spec_hierarchy_number": null,
      "item_type": "requirement",
      "classification": "functional",
      "source": "inline",
      "loc": {
        "page": 2,
        "line_start": 7,
        "line_end": 8
      },
      "content": "SYS-FUNC-003\nThe system shall avoid static and dynamic obstacles in real-time.",
      "gen_hierarchy_number": "G3.1-003",
      "gen_uid": "C3FF6F31"
    },
    {
      "item_id": "SYS-FUNC-004",
      "spec_hierarchy_number": null,
      "item_type": "requirement",
      "classification": "functional",
      "source": "inline",
      "loc": {
        "page": 2,
        "line_start": 9,
        "line_end": 10
      },
      "content": "SYS-FUNC-004\nThe system shall detect cliffs or stairs and prevent falling.",
      "gen_hierarchy_number": "G3.1-004",
      "gen_uid": "DEAEC210"
    },
    {
      "item_id": "SYS-FUNC-005",
      "spec_hierarchy_number": null,
      "item_type": "requirement",
      "classification": "functional",
      "source": "inline",
      "loc": {
        "page": 2,
        "line_start": 11,
        "line_end": 12
      },
      "content": "SYS-FUNC-005\nThe system shall support multi-room mapping and segmentation.",
      "gen_hierarchy_number": "G3.1-005",
      "gen_uid": "81140D44"
    },
    {
      "item_id": "SYS-FUNC-010",
      "spec_hierarchy_number": null,
      "item_type": "requirement",
      "classification": "functional",
      "source": "inline",
      "loc": {
        "page": 2,
        "line_start": 14,
        "line_end": 15
      },
      "content": "SYS-FUNC-010\nThe system shall generate suction power >= 5000 Pa.",
      "gen_hierarchy_number": "G3.2-001",
      "gen_uid": "77B346EB"
    },
    {
      "item_id": "SYS-FUNC-011",
      "spec_hierarchy_number": null,
      "item_type": "requirement",
      "classification": "functional",
      "source": "inline",
      "loc": {
        "page": 2,
        "line_start": 16,
        "line_end": 17
      },
      "content": "SYS-FUNC-011\nThe system shall automatically adjust suction based on detected floor type.",
      "gen_hierarchy_number": "G3.2-002",
      "gen_uid": "A72EFD58"
    },
    {
      "item_id": "SYS-FUNC-012",